"2"," ФЕДЕРАЛЬНОЕ АГЕНТСТВО ПО ОБРАЗОВАНИЮ                УДК 543.062                                                     ББК 24.4      Восточно-Сибирский государственный          технологический университет                Танганов Б.Б. Химические методы анализа: Учебное пособие/                                                     ВСГТУ.- Улан-Удэ, 2005.- 550 с.                                                      ISBN 5-89230-037-4                                                            Книга является частью курса “Основы аналитической химии” и              Б.Б.Танганов                           предназначена в качестве учебного пособия для студентов химических,                                                     химико-технологических и экологических специальностей.                                                           В книге рассмотрены основные положения теории растворов,                                                     изложены теория и практика химических методов количественного                                                     анализа (объемные и весовые методы, методы маскирования, экстрак-   ХИМИЧЕСКИЕ                                         ции и концентрирования), а также основы математической обработки                                                     данных эксперимента.                                                         В учебном пособии содержится 550 стр., 63 таблицы, 61 рисунок,  МЕТОДЫ АНАЛИЗА                                      6 приложений.                                                         Рецензенты:                                                           Карбаинов Ю.А., доктор химических наук, профессор Томского                                                     политехнического университета, академик МАНЭБ,                                                           Анцупова Т.П., доктор биологических наук, профессор кафедры                                                     «Неорганическая и аналитическая химия» Восточно-Сибирского госу-                                                     дарственного технологического университета   Рекомендовано Дальневосточным региональным             Рекомендовано к изданию решением редакционно-издательского учебно-методическим центром в качестве учебного     совета Восточно-Сибирского государственного технологического уни- пособия для студентов направлений 552400, 655600,   верситета.           655700, 655900 вузов региона              ISBN 5-89230-085-4              Танганов Б.Б., 2005 г.                                                     ББК 24.4                        ВСГТУ, 2005 г.                   Издательство ВСГТУ                  Улан-Удэ, 2005                                                                                       2                            ПРЕДИСЛОВИЕ                                               ТЕОРИЯ ХИМИЧЕСКИХ МЕТОДОВ АНАЛИЗА                                                                                          I. ОБЩИЕ ВОПРОСЫ ТЕОРИИ"  
"2","МИНИСТЕРСТВО ОБРАЗОВАНИЯ РФ                                                  УДК 543.062   Восточно-Сибирский государственный             ББК 24.4       технологический университет                                                  Танганов Б.Б. Химические методы анализа: Прак-                                             тикум по объемным и гравиметрическим методам ана-                                             лиза. Учебное пособие / ВСГТУ.- Улан-Удэ, 2000.- 279 с.                Б.Б.Танганов                       ISBN                                                   Книга “Химические методы анализа: Практикум по                                             объемным и гравиметрическим методам” предназначена в  ХИМИЧЕСКИЕ                                 качестве учебного пособия для студентов химико-техноло-                                             гических специальностей. МЕТОДЫ АНАЛИЗА                                   В книге изложены методика и техника количественно-                                             го анализа, а также теории ошибок. Рассмотрены практиче-                                             ские вопросы объемного и весового методов анализа и ма-                                             тематических методов обработки результатов эксперимента.                                                  В учебном пособии содержится 279 стр., 14 таблиц, 8      Практикум по объемным                  рисунков и 5 приложений.   и гравиметрическим методам                                                  Рецензенты: Базарова Ж.Г., член-корр. РАЕН,                                                  д.х.н., проф. Бурятского госуниверситета,                                                  Анцупова Т.П., д.б.н., проф. ВСГТУ      Учебное пособие для студентов химиков-технологов, технологов и экологов     дневной и заочной форм обучения              Рекомендовано к изданию решением редакционно-                                             издательского совета Восточно-Сибирского государст-                                             венного технологического университета.                                                   ISBN                        Танганов Б.Б., 2000 г.                                                  ББК 24.4                    ВСГТУ, 2000 г.               Улан-Удэ, 2000                              3                                                          4                                                                     I. КИСЛОТНО-ОСНОВНЫЕ РАВНОВЕСИЯ                     ПРЕДИСЛОВИЕ                                  I.1. Приготовление стандартных растворов                                                                 Основным раствором в объемном анализе является"  
"2","МИНИСТЕРСТВО ОБРАЗОВАНИЯ РОССИЙСКОЙ               ФЕДЕРАЦИИ                                               УДК 675.6.026 : 504.064.4     ВОСТОЧНО-СИБИРСКИЙ ГОСУДАРСТВЕННЫЙ                                  Шалбуев Дм.В.       ТЕХНОЛОГИЧЕСКИЙ УНИВЕРСИТЕТ                                                                        Методы очистки сточных вод после процесса крашения                                                                                 Методическое указание к выполнению лабораторных     МЕТОДЫ ОЧИСТКИ СТОЧНЫХ ВОД ПОСЛЕ                                  работ для студентов специальности 28.10.00 «Технология            ПРОЦЕССА КРАШЕНИЯ                                          кожи и меха» и специализации 28.10.01 «Экология произ-                                                                       водств кожи, меха и предприятий бытового обслуживания»   Методическое указание к выполнению лабораторных работ для студен-            В методическом указании представлен теоретиче- тов специальности 28.10.00 «Технология кожи и меха» и специализации   ский и практический материал, рассматривающий вопросы  28.10.01. «Экология производств кожи, меха и предприятий бытового                            обслуживания»                                                                       загрязнения и очистки сточных вод после процесса краше-                                                                       ния, дана краткая характеристика окислительных и кислот-                                                                       ных красителей, а также методов их удаления                                    Составитель: Шалбуев Дм.В.                                                                                    ©        Шалбуев Дмитрий Валерьевич, 2001                                                                                                ©                   ВСГТУ, 2001                            Улан-Удэ                                2001                          Введение                                   Окислительные красители относятся      к третьей"  
"2","Министерство образования Российской Федерации      ББК Восточно-Сибирский государственный технологический   Рецензент: Цыцыктуева Л.А. к.х.н., зав отделом МУП                    университет                       «Водоканал»                                                       Авторы: Хараев Г.И.                                                              Ямпилов С.С.                                                              Танганов Б.Б.                                                              Хантургаев А.Г.                                                          Методическое пособие по дисциплине «Экологический                                                      мониторинг»: Учебное пособие/ Под ред. Г.И. Хараева. –                                                      Улан-Удэ: Изд-во ВСГТУ, 2004. – 77 с.                                                      ISBN 5- 89230 –              Методическое пособие    по дисциплине «Экологический мониторинг»                                                         В    учебном    пособии    изложен     материал по                                                      нормированию содержания неорганических и органических                                                      веществ в водных системах, классификации водных                                                      объектов, общие показатели качества воды.                                                         Учебное    пособие    рассчитано    на  студентов                                                      специальностей: «Инженерная защита окружающей среды»                                                      и «Охрана окружающей среды и рациональное                                                      использование природных ресурсов».                                                          Ключевые слова: Экология, мониторинг, воздушная                                                      среда, воздушные системы, качество воды, водные                                                      объекты, сточные воды, инженерная защита.                       Улан-Удэ, 2004                     ISBN 5- 89230 –                      © Хараев Г.И.                                                                                             с соавт., 2004 г.                    Оглавление    Введение ………………………………………………..4                                                    Введение"  
"2","МИНИСТЕРСТВО                                                     Рецензия ОБРАЗОВАНИЯ РОССИЙСКИОЙ ФЕДЕРАЦИИ                   На методическое пособие по теории функций комплексного                                                     переменного для студентов 2 курса специальности «ЭСПП»,                                                     выполненную к.ф-м.н., и.о.доц. Улымжиевым М.Д., к.ф-м.н.,                                                      и.о.доц. Юмовым И.Б., ст. преп. Инхеевой Л.И., ст. преп.                                                                           Юмовой С.Ж.                                                        В работе изложен кратко теоретический материал по                                                    следующим       темам:     дифференцирование       и          ТЕОРИЯ ФУНКЦИЙ     КОМПЛЕКСНОГО ПЕРЕМЕННОГО                       интегрирование функций комплексного переменного,         Методическое пособие                       разложение функций комплексного переменного в ряд                                                    Лорана, классификация особых точек, вычеты.                                                    Приведены примеры решения задач по всем темам,                                                    варианты заданий по всем темам для самостоятельной                                                    работы.                                                       Содержание работы соответствует ГОСВО ЕН.                      Составители: М.Д.Улымжиев,    Данная работа удовлетворяет всем требованиям к                                     Л.И.Инхеева,   методическим пособиям и рекомендуется к изданию в                                       И.Б.Юмов,    РИО ВСГТУ.                                      С.Ж.Юмова                                                          Рецензент:     к.ф-м.н., и.о. доц. Васильева Е.Г.          Издательство ВСГТУ            Улан-Удэ – 2004                     3                                                             4                                                                                 1. Подмножества комплексной плоскости    В работе изложен кратко теоретический материал по"  
"2","инистерство общего и профессионального образования               Российской Федерации   ОРЕНБУРГСКИЙ ГОСУДАРСТВЕННЫЙ УНИВЕРСИТЕТ          Кафедра радиофизики и электроники                                                  Ю.Д. Лантух                                              С.Н. Пашкевич      МЕТОДИЧЕСКИЕ УКАЗАНИЯ          к лабораторным работам по оптике.     Фотометрия, геометрическая и волновая оптика                        Оренбург 1999                                                                  1                Лабораторная работа № 1 Основы фотометрии                                    Цель работы      1 Познакомиться с основными фотометрическими величинами.      2 Освоить методику измерения интенсивности лазерного излучения, его расходимости, а также калибровки регистрирующей системы.      3 Измерить распределение энергии по сечению лазерного пучка, силу света лабораторного He-Ne – лазера. Проверить выполнимость основного закона ос- вещенности.                                         1 Введение      1.1 Световой поток        Всякая реальная световая волна представляет собой наложение волн с длинами, заключенными в некотором интервале ∆λ. Этот интервал остается ко- нечным даже для монохроматического света. В белом свете ∆λ охватывает весь диапазон воспринимаемых глазом электромагнитных волн, т. е. простирается от 0,40 до 0,76 мкм.       Распределение потока энергии по длинам волн можно охарактеризовать с помощью функции распределения                                   φ(λ) = dФэ/dλ,                                (1)        где dФэ — поток энергии, приходящийся на длины волн от λ до λ + ∆λ. Зная вид функции (1), можно вычислить поток энергии, переносимой волнами, заключенными в конечном интервале от λ1 до λ2:"  
"2","МИНИСТЕРСТВО ОБРАЗОВАНИЯ И НАУКИ РОССИЙСКОЙ ФЕДЕРАЦИИ                Государственное образовательное учреждение                 высшего профессионального образования               «Оренбургский государственный университет»                            Кафедра геологии                              С.В.ВОРОБЬЁВА      МЕТОДЫ АНАЛИЗА МЕТАЛЛОВ ПЛАТИНОВОЙ ГРУППЫ, ЗОЛОТА И          СЕРЕБРА                      МЕТОДИЧЕСКОЕ РУКОВОДСТВО     Рекоменовано к изданию Редакционно-издательским советом государственного    образовательного учреждения высшего профессионального образования                «Оренбургский государственный университет»                                  Оренбург 2004   ББК      В-75 УДК 553.3.071+622.7+669.21/32 : 543.5          Рецензент       доктор химических наук, профессор А.В.Стряпков         Воробьёва С.В.   В-75 Методы анализа металлов платиновой группы, золота и серебра:       Методическое руководство. – Оренбург: ГОУ ОГУ, 2004. – 18 с.               В методическом руководстве охарактеризованы основные методы       определения содержаний благородных металлов в разведочных пробах и       промышленных продуктах и заводских сплавах. Описан метод       определения пробы благородных металлов на пробирном камне.            Методичекое руководство предназначено для студентов третьего       курса специальности 080100, при изучении дисциплины «Лабораторные       методы изучения полезных ископаемых»                                                      © Воробьёва С.В., 2004                                                  © ГОУ ОГУ, 2004                                     Введение"  
"2"," МИНИСТЕРСТВО ОБРАЗОВАНИЯ И НАУКИ РОССИЙСКОЙ ФЕДЕРАЦИИ                Государственное образовательное учреждение                 высшего профессионального образования               «Оренбургский государственный университет»                            Кафедра геологии                              С.В.ВОРОБЬЁВА      МЕТОДЫ АНАЛИЗА МЕТАЛЛОВ ПЛАТИНОВОЙ ГРУППЫ, ЗОЛОТА И          СЕРЕБРА                      МЕТОДИЧЕСКОЕ РУКОВОДСТВО     Рекоменовано к изданию Редакционно-издательским советом государственного    образовательного учреждения высшего профессионального образования                «Оренбургский государственный университет»                                  Оренбург 2004   ББК      В-75 УДК 553.3.071+622.7+669.21/32 : 543.5          Рецензент       доктор химических наук, профессор А.В.Стряпков         Воробьёва С.В.   В-75 Методы анализа металлов платиновой группы, золота и серебра:       Методическое руководство. – Оренбург: ГОУ ОГУ, 2004. – 18 с.               В методическом руководстве охарактеризованы основные методы       определения содержаний благородных металлов в разведочных пробах и       промышленных продуктах и заводских сплавах. Описан метод       определения пробы благородных металлов на пробирном камне.            Методичекое руководство предназначено для студентов третьего       курса специальности 080100, при изучении дисциплины «Лабораторные       методы изучения полезных ископаемых»                                                      © Воробьёва С.В., 2004                                                  © ГОУ ОГУ, 2004                                     Введение"  
