"3","Motorola Expects Strong Sales Growth"," SINGAPORE (Reuters) - Motorola Inc., the world's  second-largest mobile phone maker, said on Tuesday it expects  to sustain strong sales growth in the second half of 2004  thanks to new handsets with innovative designs and features."
"1","Fighting in Western Afghanistan Kills 3 (AP)","AP - Fighting between rival factions in western Afghanistan killed three militiamen and injured another seven, officials said Tuesday, despite the presence of government and U.S. troops."
"2","Phelps's chase of Spitz mark? It's history","This was the event Michael Phelps didn't really need to compete in if his goal was to win eight golds. He probably would have had a better chance somewhere else."
"2","US dominance an impossible dream","It has come to this: Good thing we're in the easy bracket. The United States men's basketball team is in Pool B, along with Greece, Australia, Lithuania, Angola, and, of course, Puerto Rico, the feisty little brother who enjoyed a pretty big laugh at the expense of Uncle Sam's boys Sunday night. Most of the serious teams are ..."
"2","Rangers remain in step","Brian Jordan hit a tiebreaking homer in the sixth inning and the Texas Rangers extended their winning streak to four games with a 5-2 victory over the visiting Cleveland Indians last night."
"2","Watson holdout ends","After an 18-day holdout during which he parted ways with his second agent (IMG's Tom Condon , who replaced Darrell Wills , formerly of IMG but now decertified) and hired a third ( Pat Dye Jr. ), first-round pick Benjamin Watson signed a six-year contract and reported to training camp yesterday."
"2","A bit of a head-scratcher","In many professional leagues recently, the defending champion has had a smooth start to the season. Mexico proved to be an exception, though, as UNAM Pumas fell to Tecos, 1-0, losing two players and coach Hugo Sanchez to ejections Sunday."
"2","Czech hockey coach Hlinka dies after car crash","Ivan Hlinka, a former Pittsburgh Penguins coach who led the Czech Republic to a gold medal at the 1998 Nagano Olympics, died yesterday after being injured in a car crash. He was 54."
"2","Bronze is golden to Methuen's Pedro","Standing in the snow at a medal celebration at the 2002 Winter Games at Salt Lake City, Jimmy Pedro had a sudden inspiration. He took out his cellphone and called his wife, Marie, back in Methuen, Mass."
"2","Greeks get surprise gold in synchronized diving","It was a glorious surprise, igniting a party complete with song and dance: The Greeks won the first gold medal of their hometown Olympics with an unexpected victory last night in synchronized diving."
"2","McCool not getting off the mat","The US women's gymnastics team, which wlll go after Olympic gold tonight, will be doing it without Courtney McCool , whom the coaching staff left off the roster after she had a rough night in Sunday's prelims."
"2","Red Sox and Patriots ceremoniously beaten","Boston sports fans have a track record. Predictably, we watch the Red Sox, Patriots, and big events. So it gets interesting when they go head to head, as they did Friday night. A look at the ratings confirms that the Olympics qualify as an extremely big event."
"2","Today's schedule","Pro baseball: Red Sox vs. Toronto at Fenway Park, 7 p.m.; Atlantic League -- Nashua vs. Camden at Holman Stadium, Nashua, 6:30 p.m.; International League -- Pawtucket vs. Buffalo at McCoy Stadium, Pawtucket, R.I., 7 p.m.; Eastern League: Portland vs. New Britain at Hadlock Field, Portland, Maine, 7 p.m.; Northeast League -- Brockton vs. New Haven at Campanelli Stadium, Brockton, ..."
"1","Israel to Build New Housing Units (AP)","AP - The Israeli government on Tuesday invited construction bids for 1,001 new homes in Jewish settlements in the West Bank, an official said, in direct violation of a U.S.-backed peace plan calling for a settlement freeze."
"1","Sharon 'backs settlement homes'","Reports say Israeli PM Ariel Sharon has given the green light to new homes in West Bank settlements."
"1","Oprah to sit on murder trial jury","US television host Oprah Winfrey is picked to sit on the jury for a murder trial in her home city of Chicago."
"4","Motorola Expects Strong Sales Growth (Reuters)","Reuters - Motorola Inc., the world's\second-largest mobile phone maker, said on Tuesday it expects\to sustain strong sales growth in the second half of 2004\thanks to new handsets with innovative designs and features."
"1","U.S. Handling of Helicopter Crash Irks Okinawa (Reuters)","Reuters - Cities in Okinawa expressed outrage at\the U.S. military on Tuesday for refusing to allow Japanese\police investigate the wreckage of a Marine helicopter that\crashed in the grounds of a university there last week."
"1","Testimony Opens in 9/11 Retrial Case (AP)","AP - A witness who knew the Hamburg-based Sept. 11 hijackers outlined the group's hatred of Israel and said its members believed suicide attacks were legitimate as testimony opened Tuesday in the retrial of a Moroccan accused of helping the pilots."
"4","Home PCs to get key Windows fix","PC owners will be able to download a major security update for Windows XP as from Wednesday."
"4","Science creates 'own mavericks'","Britain's scientific community fuels controversies by shunning colleagues with rebel ideas, research suggests."
"2","Ward, Pujols, Jones Put Up Big Numbers (AP)","AP - Daryle Ward, Albert Pujols and Chipper Jones had big nights at the plate at the expense of National League pitchers."
"2","Olympics: Greeks Dive for Joy, More Gold for Thorpe"," ATHENS (Reuters) - Greece was plunged in national  self-satisfaction on Tuesday after its synchronized divers won  the host nation's first gold medal of the Athens Olympics."
"1","India agree contracts","India players agree central contracts for the first time, with top stars netting a basic salary of 59,000."
"1","Mortar Attack in Central Baghdad Kills 5","BAGHDAD, Iraq - Insurgents fired a mortar on a busy street in central Baghdad on Tuesday, killing five people and wounding 30, the Interior Ministry and hospital officials said.    Iraqi officials had earlier reported the explosion was a car bomb, but later corrected that account..."
"3","Oil Slips Below \$46 on Venezuela, Russia"," LONDON (Reuters) - Oil prices eased on Tuesday as fears of  supply disruptions in Venezuela and Russia receded following a  convincing referendum victory for Venezuelan President Hugo  Chavez and after Russia's YUKOS said it had received an  assurance on September exports."
"4","Crack Fedora Core and Red Hat Enterprise Linux","&lt;strong&gt;Site Offer&lt;/strong&gt; Save 30 at The Reg Bookshop"
"1","Burundi Army Says Might Enter Congo After Massacre (Reuters)","Reuters - The Burundian army said on Tuesday it\might cross into neighboring Congo to pursue rebels and militia\it blames for massacring 160 Congolese Tutsi refugees at a camp\in western Burundi."
"4","New Flightless Bird Species Found Off Philippines (Reuters)","Reuters - Scientists have discovered a new\species of flightless bird on a remote island in the\Philippines, the conservation group BirdLife International said\on Tuesday."
"4","Macromedia to bolster video on the Web","Macromedia on Tuesday is announcing a video kit to enable users of its authoring tools suite, Macromedia Studio MX 2004 with Flash Professional, to more easily add video to their Web sites."
"2","Olympics: China Halfway to Completing Medals Plan"," ATHENS (Reuters) - China led the Olympic medal race going  into the fourth day of competition on Tuesday with 10 golds."
"1","NY Seen Steady; Eyes on AMAT, Motorola (Reuters)","Reuters - Wall Street was set for a steady start\on Tuesday as crude oil prices eased, with results from chip\group Applied Materials (AMAT.O) and inflation data a focus,\while shares in a bullish Motorola (MOT.N) may rise."
"1","Burundi Army Says Might Enter Congo After Massacre"," BUJUMBURA (Reuters) - The Burundi army said on Tuesday it  might cross into neighboring Congo to pursue rebels and militia  it blames for massacring 160 Congolese Tutsi refugees at a camp  in western Burundi."
"3","Home Depot Quarterly Profit Rises (Reuters)","Reuters - Home Depot Inc. (HD.N), the world's\largest home improvement retailer, on Tuesday said quarterly\profit rose, topping estimates, as technology upgrades and\other store improvements helped boost sales."
"3","Home Depot Quarterly Profit Rises"," ATLANTA (Reuters) - Home Depot Inc. &lt;A HREF=""http://www.investor.reuters.com/FullQuote.aspx?ticker=HD.N target=/stocks/quickinfo/fullquote""&gt;HD.N&lt;/A&gt;, the world's  largest home improvement retailer, on Tuesday said quarterly  profit rose, topping estimates, as technology upgrades and  other store improvements helped boost sales."
"3","Dollar Mired Near Lows Before U.S. Data"," LONDON (Reuters) - The dollar hovered near a one-month low  against the euro on Tuesday as investors awaited U.S. inflation  data later in the day for clues on the future path of interest  rates."
"1","American Allies Embrace U.S. Military Plan (AP)","AP - American allies Japan and Australia embraced a new U.S. plan to restructure its forces abroad, while Russia said it was not concerned by the proposal. But Germany, home to 70,000 U.S. soldiers, said any withdrawal from the former Cold War frontier may hurt its economy."
"1","Taiwan Offers Compromise on Direct China Links"," TAIPEI (Reuters) - Taiwan President Chen Shui-bian proposed  on Tuesday to define direct transport links with rival China as  cross-Strait routes, in a bid to bypass a longstanding  political dispute, but Beijing is likely to ignore him."
"1","Baghdad Blast Kills Seven, Najaf Fighting Rages"," BAGHDAD (Reuters) - A shell killed seven people in a busy  Baghdad street on Tuesday and U.S. forces fought pitched  battles with Shi'ite militia in the holy city of Najaf."
"3","Oil giant Yukos in plea for time","Russian oil giant Yukos is to ask a Moscow court for more time to pay its tax bill."
"3","Finance workers in union merger","A total of 140,000 members at union Unifi are absorbed into Amicus to create a 'super-union' for UK finance workers."
"4","IT managers prescribe holistic security","&lt;strong&gt;Reg Reader Studies&lt;/strong&gt; But don't swallow own medicine"
"4","UK gamers rush to snap up Doom 3","The eagerly anticipated Doom 3 has stormed to the top of the UK games charts."
"1","Wanted: Sleeping Space for Protesters. Hot Water Optional.","The protesters coming to New York are receiving an outpouring of hospitality from scores of people who are opening their homes as temporary, free shelter."
"3","Dollar Mired Near Lows Before U.S. Data (Reuters)","Reuters - The dollar hovered near a one-month low\against the euro on Tuesday as investors awaited U.S. inflation\data later in the day for clues on the future path of interest\rates."
"3","Home Depot Profit Tops Estimates on Sales"," ATLANTA (Reuters) - Home Depot Inc. &lt;A HREF=""http://www.investor.reuters.com/FullQuote.aspx?ticker=HD.N target=/stocks/quickinfo/fullquote""&gt;HD.N&lt;/A&gt; on Tuesday  reported a 19 percent rise in second-quarter profit, topping  estimates, as technology upgrades and other store improvements  helped boost sales."
"4","Warming threatens California wine","California is to get hotter and drier by the end of the century, threatening its valuable wine industry."
"1","North Korea Talks Still On, China Tells Downer"," BEIJING (Reuters) - North Korea's refusal to take part in  working-level talks on the nuclear crisis prompted a diplomatic  flurry on Tuesday with China, the host of the talks, at the  heart of efforts to keep the process on track."
"1","Israel Invites Bids in Construction Plan (AP)","AP - Israeli Prime Minister Ariel Sharon has approved bids for construction of 1,000 homes in Jewish West Bank settlements after freezing them earlier this month, amid growing friction with the United States over continued settlement expansion."
"1","Higher oil prices to trim China's 2004 GDP growth (AFP)","AFP - Surging oil prices could moderate China's economy this year as rising costs push inflation higher, hitting corporate profits and consumer pocket books, analysts and state press said."
"4","Motorola Expects Strong Sales Growth","Motorola Inc., the world's\second-largest mobile phone maker, said on Tuesday it expects\to sustain strong sales growth in the second half of 2004\thanks to new handsets with innovative designs and features."
"4","Soldering Surprise","There's nothing routine about working in space, as astronaut Mike Fincke found out recently when he did some soldering onboard the International Space Station."
"2","U.S. Gymnasts End Rebuilding With Silver (AP)","AP - Twenty years later, the boys are back on the medal stand."
"1","Three Members of Bhutto's Party Killed (AP)","AP - Unidentified gunmen opened fire on supporters of former Prime Minister Benazir Bhutto's party ahead of a key by-election, killing three people, police said Tuesday."
"1","Sharon Allows 1,000 More Settler Homes in West Bank"," JERUSALEM (Reuters) - Prime Minister Ariel Sharon has  approved building tenders for 1,000 more Israeli settlement  homes in the occupied West Bank frozen earlier to avoid  upsetting the United States, political sources said on Tuesday."
"3","Staples Posts Sharply Higher Profit (Reuters)","Reuters - Staples Inc. (SPLS.O), the top U.S.\office products retailer, on Tuesday reported a 39 percent jump\in quarterly profit as a weaker dollar boosted results abroad\and initial back-to-school demand drove sales."
"4","Vote now to name BSA's antipiracy weasel","&lt;strong&gt;Poll&lt;/strong&gt; The Mother of all Mustelid polls"
"1","Russian Court Rejects Researchers' Appeal (AP)","AP - The Russian Supreme Court on Tuesday rejected an appeal from an arms control researcher who was sentenced to 15 years in prison for treason in what rights advocates have called a politically motivated case."
"4","Blu-ray burns for interactive content","Flashy features could tempt consumers--and that tempts Hollywood, which could help Blu-ray beat out a rival technology."
"4","Standards battle could shoot both sides in foot","Tussle over next-generation DVD format could alienate consumers.\"
"1","Revealing Hospital Gowns Redesigned","PORTLAND, Maine - Whether its blue or spotted or stripped, the standard issue hospital gown is drafty and revealing. It's embarrassing for just about anyone who's spent a night in a medical center..."
"1","Stocks to Be in a Cautious Mood at Open","NEW YORK - U.S. stocks are seen in a cautious mood at the open Tuesday as investors weigh up the merits of Monday's oil-inspired rally..."
"1","Hostile Takeover","The battle moves to the political arena as Taipei and Beijing wrap up their wargames"
"1","Giving Back Hope","A controversial procedure for injured spines has turned a Beijing hospital into a medical mecca\"
"3","Home Depot Rises Before the Bell"," NEW YORK (Reuters) - Shares in Home Depot Inc. &lt;A HREF=""http://www.investor.reuters.com/FullQuote.aspx?ticker=HD.N target=/stocks/quickinfo/fullquote""&gt;HD.N&lt;/A&gt; rose  before the opening bell on Tuesday after the world's largest  home improvement retailer reported a 19 percent rise in  second-quarter profit."
"4","BOFH takes a hit from Cupid's arrow","&lt;strong&gt;Episode 26&lt;/strong&gt; Shall I compare thee to an OS2-free Intel box?"
"4","Nortel Says Canada Plans Accounting Probe","Nortel Networks Corp. said on Monday the Royal Canadian Mounted Police told\the company it will begin a criminal investigation into"
"4","Two Plead Not Guilty in Hacking Case","Two men accused of aiding a Romanian man charged with hacking into the online ordering system of the world's largest computer equipment distributor pleaded not guilty Monday to charges of mail fraud and conspiracy to commit mail fraud."
"4","Rival Targets Apple's ITunes Customers","For more than a year, Apple Computers Inc. enjoyed singular success selling songs exclusively to users of its iPod portable music player. Now, it's got rival RealNetworks Inc. trying to lure iTunes customers away."
"4","Free-Speech for Online Gambling Ads Sought","The operator of a gambling news site on the Internet has asked a federal judge to declare that advertisements in U.S. media for foreign online casinos and sports betting outlets are protected by free-speech rights."
"1","US hurricane victims face turmoil","Many victims of Florida's worst hurricane for years are still homeless, with no electricity or telephone services."
"3","Google seeks OK to sell shares","Google has signaled that its share auction is nearly complete, asking the Securities and Exchange Commission for approval to begin selling 25.7 million shares of stock starting late this afternoon."
"3","\$1.1b deal to join hospital chains","BRENTWOOD, Tenn. -- LifePoint Hospitals Inc. , an operator of acute care facilities in rural areas, outlined a deal yesterday to buy rival Province Healthcare Co. for about \$1.1 billion in cash and stock."
"3","J.C. Penney Posts Second-Quarter Profit (Reuters)","Reuters - Department store operator J.C. Penney\Co. Inc. (JCP.N) on Tuesday posted a second-quarter profit,\reversing a year-earlier loss, helped by inventory controls and\strong department store sales."
"3","German investor confidents slides on high oil prices (AFP)","AFP - Investor confidence in Germany has declined more sharply than anticipated, a major economic think tank said, as high oil prices put a damper on hopes of a continuation of the nascent recovery."
"3","J.C. Penney Posts Second-Quarter Profit"," NEW YORK (Reuters) - Department store operator J.C. Penney  Co. Inc. &lt;A HREF=""http://www.investor.reuters.com/FullQuote.aspx?ticker=JCP.N target=/stocks/quickinfo/fullquote""&gt;JCP.N&lt;/A&gt; on Tuesday posted a second-quarter profit,  reversing a year-earlier loss, helped by inventory controls and  strong department store sales."
"3","Staples Profit Up Sharply, to Enter China"," NEW YORK (Reuters) - Staples Inc. &lt;A HREF=""http://www.investor.reuters.com/FullQuote.aspx?ticker=SPLS.O target=/stocks/quickinfo/fullquote""&gt;SPLS.O&lt;/A&gt;, the top U.S.  office products retailer, on Tuesday reported a 39 percent jump  in quarterly profit, raised its full-year forecast and said it  plans to enter the fast-growing Chinese market."
"3","Estee Lauder Quarterly Profit Climbs"," CHICAGO (Reuters) - Cosmetics manufacturer Estee Lauder  Cos. Inc. &lt;A HREF=""http://www.investor.reuters.com/FullQuote.aspx?ticker=EL.N target=/stocks/quickinfo/fullquote""&gt;EL.N&lt;/A&gt; on Tuesday posted a bigger quarterly profit,  bolstered by sales in Europe and an improving U.S. retail  market."
"3","BJ's Profit Rises; Food, Gas Sales Strong"," CHICAGO (Reuters) - BJ's Wholesale Club Inc. &lt;A HREF=""http://www.investor.reuters.com/FullQuote.aspx?ticker=BJ.N target=/stocks/quickinfo/fullquote""&gt;BJ.N&lt;/A&gt; on  Tuesday posted higher quarterly profit as soaring gasoline  prices and strong demand for food boosted sales."
"4","PalmOne Unveils SD Wi-Fi Card (PC World)","PC World - Tiny 802.11b adapter will work with Zire 72, Tungsten T3 handhelds."
"2","Americans Miss Cut","In a stunning blow to the U.S., Americans Ian Crocker and Jason Lezak miss the cut in the 100-meter freestyle preliminaries."
"1","Twins of the world unite in France (AFP)","AFP - A tiny French village in Brittany -- the self proclaimed capital of twin-dom -- has played host to an international gathering of thousands of identical twins, triplets and quadruplets."
"1","Developing states to seek voice in fighting terror (Reuters)","Reuters - Developing nations launched their annual diplomatic summit on Tuesday with a plea to the United States and other powerful countries to consult them on tackling terror and resolving the Middle East conflict"
"4","Symantec Upgrades Norton Security Products","Revamped Norton AntiVirus, Personal Firewall, and AntiSpam tools fight pests and dangers online."
"1","Afghan president gains backing of militia commanders ahead of polls (AFP)","AFP - A lieutenant of powerful northern warlord General Abdul Rashid Dostam pledged to back incumbent Hamid Karzai in the upcoming presidential vote and said 149 other military commanders would join him."
"1","Iraqi Delegation Flies to Najaf in Peace Bid"," BAGHDAD (Reuters) - A delegation of Iraqi political and  religious leaders flew out of Baghdad on U.S. military  helicopters Tuesday, heading for Najaf in a bid to end a bloody  Shi'ite uprising, delegates said."
"1","U.S. to Give Cuba  #36;50,000 Hurricane Aid (AP)","AP - Cubans hit hard by hurricane Charley will receive  #36;50,000 in U.S. assistance, the State Department said Friday."
"3","Euro industrial production slows","Industrial production in the eurozone \falls by 0.4 in June from May, with Germany registering the biggest fall."
"3","German welfare rallies escalate","Eastern Germany sees more mass protests over welfare cuts, with smaller rallies in western cities."
"4","Ice yields ancient 'plant matter'","Scientists drilling ice cores in Greenland have recovered what appear to be plant remains from nearly 3km (two miles) below the surface."
"4","Many engineers lack a four-year degree","The news comes as some observers warn that the United States needs to focus more on training scientists and engineers."
"4","AMD begins shipments of Oakville mobile chips","Advanced Micro Devices Inc. (AMD) has begun shipping commercial versions of its Athlon 64 processors made using a 90-nanometer process, marking another step forward in the company's transition to the more advanced manufacturing technology."
"4","Google seeks to end auction Tuesday","Google Inc. wants to conclude its share auction Tuesday, setting the stage for its stock to go public Wednesday, according to a statement on its IPO (initial public offering) Web site."
"1","Germany Shaken by U.S. Plans to Withdraw Troops"," BERLIN (Reuters) - The German government said on Tuesday  U.S. plans to pull out 30,000 troops were a sign of Europe's  divisions being healed, but communities hit by the decision  warned they were headed for economic disaster."
"1","Americans Miss Cut in 100-Meter Freestyle","ATHENS, Greece - Top American sprinters Jason Lezak and Ian Crocker missed the cut in the Olympic 100-meter freestyle preliminaries Tuesday, a stunning blow for a country that had always done well in the event.    Pieter van den Hoogenband of the Netherlands and Australian Ian Thorpe advanced to the evening semifinal a day after dueling teenager Michael Phelps in the 200 freestyle, won by Thorpe..."
"1","790,000 Still Have No Power in Florida","PUNTA GORDA, Fla. - About 790,000 people remain without power in Florida in the aftermath of Hurricane Charley, and officials estimate it could take weeks to get electricity fully restored..."
"1","'Boots' Takes Gold at the Ferret Olympics","SPRINGFIELD, Ore. - While world-class athletes were grunting and groaning on the other side of the Atlantic Sunday, ""Boots"" went for the gold here in his own way..."
"3","Saks Posts Wider Second-Quarter Loss (Reuters)","Reuters - Saks Inc. (SKS.N) on Tuesday posted a\wider quarterly loss as poor sales at its lower-priced\department stores outweighed a strong performance at its Saks\Fifth Avenue luxury chain."
"3","July Consumer Prices Drop, Energy Tumbles"," WASHINGTON (Reuters) - U.S. consumer prices dropped in July  for the first time in eight months as a sharp run up in energy  costs reversed, the government said on Tuesday in a report  showing underlying inflation pressures largely in check."
"3","Housing Starts Rebound Sharply in July"," WASHINGTON (Reuters) - Housing starts rebounded sharply in  July, making up almost all the ground lost in a June slump by  posting their largest monthly percentage gain since September  2002, a report from the Commerce Department on Tuesday showed."
"3","Home Depot, Motorola Rise Before Bell"," NEW YORK (Reuters) - Shares of Home Depot Inc. &lt;A HREF=""http://www.investor.reuters.com/FullQuote.aspx?ticker=HD.N target=/stocks/quickinfo/fullquote""&gt;HD.N&lt;/A&gt; rose  before the opening bell on Tuesday after the world's largest  home improvement retailer reported a 19 percent rise in  second-quarter profit."
"4","Researchers Develop Method to Find Algae (AP)","AP - Marine researchers are hoping to prevent tides of destructive algae from killing fish and fouling beaches through early detection of the microscopic organisms."
"1","U.S. Brokers Cease-fire in Western Afghanistan"," KABUL (Reuters) - The United States has brokered a  cease-fire between a renegade Afghan militia leader and the  embattled governor of the western province of Herat,  Washington's envoy to Kabul said Tuesday.  ""Our expectation is that the agreement that has been made will  be honored,"" said ambassador Zalmay Khalilzad, adding that the  cease-fire was due to take effect at 4 p.m."
"1","Football: Liverpool sign Nunez","Liverpool boss Rafael Benitez seals the signing of Antonio Nunez from Real Madrid."
"3","July Consumer Prices Drop, Energy Tumbles (Reuters)","Reuters - U.S. consumer prices dropped in July\for the first time in eight months as a sharp run up in energy\costs reversed, the government said on Tuesday in a report\showing underlying inflation pressures largely in check."
"3","Housing Starts Rebound Sharply in July (Reuters)","Reuters - Housing starts rebounded sharply in\July, making up almost all the ground lost in a June slump by\posting their largest monthly percentage gain since September\2002, a report from the Commerce Department on Tuesday showed."
