"1","Lab8_TkachenkoIA_KTbo1-8","Министерство науки и высшего образования Российской Федерации Федеральное государственное автономное образовательное учреждение высшего образования «ЮЖНЫЙ ФЕДЕРАЛЬНЫЙ УНИВЕРСИТЕТ» (ФГАОУ ВО «ЮФУ») Институт компьютерных технологий и информационной безопасности ЛАБОРАТОРНАЯ РАБОТА №7 «Автоматические генераторы проектов» по курсу: «Введение в инженерную деятельность»"
"1","Lab6_TkachenkoIA_KTbo1-8","Министерство науки и высшего образования Российской Федерации Федеральное государственное автономное образовательное учреждение высшего образования «ЮЖНЫЙ ФЕДЕРАЛЬНЫЙ УНИВЕРСИТЕТ» (ФГАОУ ВО «ЮФУ») Институт компьютерных технологий и информационной безопасности ЛАБОРАТОРНАЯ РАБОТА №6 «Автоматические генераторы проектов» по курсу: «Введение в инженерную деятельность»"
"2","учебное пособие","Ю. А. БРЮХОМИЦКИЙ БЕЗОПАСНОСТЬ ИНФОРМАЦИОННЫХ ТЕХНОЛОГИЙ Учебное пособие в двух частях Часть 1 Ростов-на-Дону – Таганрог Издательство Южного федерального университета 2020 Введение 2 УДК 004.056.5(075.8) ББК 32.97я73 Б898 Печатается по решению кафедры информационной безопасности Института компьютерных технологий и информационной безопасности Южного федерального университета (протокол № 6 от 6 марта 2020 г.) Рецензенты: заведующий кафедрой системного анализа и телекоммун "
"2","Greek runners are suspended","ATHENS -- Star sprinters Kostas Kenteris and Katerina Thanou were suspended yesterday from the Greek Olympic team for missing drug tests, but their fate was left in the hands of the International Olympic Committee."
"2","Throwbacks: Gannon, Collins in good form","Rich Gannon , the 2002 NFL MVP who was knocked out of the Raiders' loss to Kansas City last Oct. 20 and had shoulder surgery in November, was 9 for 15 for 69 yards in visiting Oakland's 33-30 exhibition win over the San Francisco 49ers last night."
"2","Enough to make you flip","Friday night came as close to an old-time local battle for viewers among Channels 4, 5, and 7 as we're likely to see. It was a throwback to pre-cable, pre-dish, and even pre-UHF days as the three local  quot;originals quot; served up a special night of sports programming. Although Red Sox-White Sox was on Channel 4's  quot;sister quot; station, Channel 38, it ..."
"2","For Revolution, this tie looks good","WASHINGTON -- Rookie Andy Dorman didn't even have time to get his white, long-sleeved jersey smudged on the sloppy RFK Stadium field last night before salvaging a 2-2 tie for the Revolution against D.C. United. Fifty-five seconds after entering the game as a late substitute, Dorman buried a low shot from inside the penalty area and extended his team's unbeaten ..."
"2","Sing Me Back Home matches track mark","OCEANPORT, N.J. -- Sing Me Back Home pulled away in the stretch to win the \$60,000 Decathalon Handicap at Monmouth Park yesterday, equaling the track record for 5 furlongs."
"2","Haas in fine form","HAVEN, Wis. -- If he were acting his age, Jay Haas would have had the weekend off, resting on his laurels and reaping the benefits of the nice-and-easy Champions Tour."
"2","USC starts at the top","Southern California greeted news of its first preseason No. 1 ranking since 1979 with ambivalence."
"2","'Gardening' costs Appleby -- in spades","HAVEN, Wis. -- For 18 holes, Stuart Appleby played flawless golf in yesterday's third round, four birdies and 14 pars. It wasn't until he was done playing that he discovered that it wasn't as good a day as he had thought, that he had made a quadruple bogey."
"2","Hungarian GP, Qualifying","Fifth and ninth for Fernando and Jarno following qualifying for tomorrow's Hungarian Grand Prix."
"2","Budapest, Free Practice 3 and 4: A tight battle in store","The teams have just finished their final preparations for the race and qualifying, in much lower temperatures than yesterday."
"2","Overtaking at Budapest? Its possible","The Renault F1 Team drivers explain how you can make up positions at the Hungarian circuit."
"2","Budapest, Day 1: everythings on track","The Renault F1 Team ran through its programme without worrying about the timesheets or its rivals. The focus has been on Sundays race, not Fridays glory."
"2","Hungarian GP, Friday Round-Up","Fernando tenth and Jarno seventeenth but no cause for concern, while Pat Symonds explains the challenges of Fridays at the race."
"2","Redskins Get the Boot","A fourth-quarter lead proves fleeting for the Redskins as John Kasay hits a 52-yard field goal Saturday to give the Panthers a 23-20 overtime win."
"2","Trojans Open Up No. 1","Defending national champion USC begins the 2004 season right where it left off the year before - as the top ranked team in the AP Top 25 poll."
"2","Offense Needs Work","There were few offensive highlights during Virginia Tech's first scrimmage of fall practice on Saturday."
"2","Huey Exits Early","Treat Huey, the two-time All-Met Player of the year, suffered a 6-2, 6-0 loss to 29-year-old journeyman Mashiska Washington, the younger brother of former pro and 1996 Wimbledon finalist Malivai."
"2","True Sensation Wins A Wet One at Pimlico","BALTIMORE, Aug. 14 -- Even before Hurricane Charley ranged up the East Coast and began to drop its drizzle on Pimlico Race Course, the \$75,000 All Brandy Stakes for Maryland-bred fillies and mares had been taken off the track's beat-up turf course."
"2","Lynx Infielder Fontenot Has 'Pretty Good Pop for His Size'","At 5 feet 8, 160 pounds, second baseman Mike Fontenot looks more like the Class AAA Ottawa Lynx's batboy than one of the Baltimore Orioles' top prospects."
"1","Lab8_TkachenkoIA_KTbo1-8","Министерство науки и высшего образования Российской Федерации Федеральное государственное автономное образовательное учреждение высшего образования «ЮЖНЫЙ ФЕДЕРАЛЬНЫЙ УНИВЕРСИТЕТ» (ФГАОУ ВО «ЮФУ») Институт компьютерных технологий и информационной безопасности ЛАБОРАТОРНАЯ РАБОТА №7 «Автоматические генераторы проектов» по курсу: «Введение в инженерную деятельность»"
"1","Lab6_TkachenkoIA_KTbo1-8","Министерство науки и высшего образования Российской Федерации Федеральное государственное автономное образовательное учреждение высшего образования «ЮЖНЫЙ ФЕДЕРАЛЬНЫЙ УНИВЕРСИТЕТ» (ФГАОУ ВО «ЮФУ») Институт компьютерных технологий и информационной безопасности ЛАБОРАТОРНАЯ РАБОТА №6 «Автоматические генераторы проектов» по курсу: «Введение в инженерную деятельность»"
"1","Lab8_TkachenkoIA_KTbo1-8","Министерство науки и высшего образования Российской Федерации Федеральное государственное автономное образовательное учреждение высшего образования «ЮЖНЫЙ ФЕДЕРАЛЬНЫЙ УНИВЕРСИТЕТ» (ФГАОУ ВО «ЮФУ») Институт компьютерных технологий и информационной безопасности ЛАБОРАТОРНАЯ РАБОТА №7 «Автоматические генераторы проектов» по курсу: «Введение в инженерную деятельность»"
"1","Lab6_TkachenkoIA_KTbo1-8","Министерство науки и высшего образования Российской Федерации Федеральное государственное автономное образовательное учреждение высшего образования «ЮЖНЫЙ ФЕДЕРАЛЬНЫЙ УНИВЕРСИТЕТ» (ФГАОУ ВО «ЮФУ») Институт компьютерных технологий и информационной безопасности ЛАБОРАТОРНАЯ РАБОТА №6 «Автоматические генераторы проектов» по курсу: «Введение в инженерную деятельность»"
"2","Australia, U.S. Set Record","The U.S. women's and men's eights team both set world bests in the Olympic rowing competition Sunday along with Australian pair Sally Newmarch and Amber Halliday."
"2","Phelps On Relay Team","Michael Phelps is named to the 4x100-meter freestyle relay team that will compete in Sunday's final, keeping alive his quest for a possible eight Olympic gold medals."
"2","Lynx Infielder Fontenot Has 'Pretty Good Pop for His Size'","At 5 feet 8, 160 pounds, second baseman Mike Fontenot looks more like the Class AAA Ottawa Lynx's batboy than one of the Baltimore Orioles' top prospects."
"1","Lab8_TkachenkoIA_KTbo1-8","Министерство науки и высшего образования Российской Федерации Федеральное государственное автономное образовательное учреждение высшего образования «ЮЖНЫЙ ФЕДЕРАЛЬНЫЙ УНИВЕРСИТЕТ» (ФГАОУ ВО «ЮФУ») Институт компьютерных технологий и информационной безопасности ЛАБОРАТОРНАЯ РАБОТА №7 «Автоматические генераторы проектов» по курсу: «Введение в инженерную деятельность»"
"1","Lab6_TkachenkoIA_KTbo1-8","Министерство науки и высшего образования Российской Федерации Федеральное государственное автономное образовательное учреждение высшего образования «ЮЖНЫЙ ФЕДЕРАЛЬНЫЙ УНИВЕРСИТЕТ» (ФГАОУ ВО «ЮФУ») Институт компьютерных технологий и информационной безопасности ЛАБОРАТОРНАЯ РАБОТА №6 «Автоматические генераторы проектов» по курсу: «Введение в инженерную деятельность»"
"1","Lab8_TkachenkoIA_KTbo1-8","Министерство науки и высшего образования Российской Федерации Федеральное государственное автономное образовательное учреждение высшего образования «ЮЖНЫЙ ФЕДЕРАЛЬНЫЙ УНИВЕРСИТЕТ» (ФГАОУ ВО «ЮФУ») Институт компьютерных технологий и информационной безопасности ЛАБОРАТОРНАЯ РАБОТА №7 «Автоматические генераторы проектов» по курсу: «Введение в инженерную деятельность»"
"1","Lab6_TkachenkoIA_KTbo1-8","Министерство науки и высшего образования Российской Федерации Федеральное государственное автономное образовательное учреждение высшего образования «ЮЖНЫЙ ФЕДЕРАЛЬНЫЙ УНИВЕРСИТЕТ» (ФГАОУ ВО «ЮФУ») Институт компьютерных технологий и информационной безопасности ЛАБОРАТОРНАЯ РАБОТА №6 «Автоматические генераторы проектов» по курсу: «Введение в инженерную деятельность»"
"3","Strategies for a Sideways Market (Reuters)","Reuters - The bulls and the bears are in this\together, scratching their heads and wondering what's going to\happen next."
"3","Art Looks Like Fine Investment for Funds (Reuters)","Reuters - Some mutual funds invest in stocks;\others invest in bonds. Now a new breed of funds is offering\the chance to own fine art."
"3","Oil and Economy Cloud Stocks' Outlook (Reuters)","Reuters - Soaring crude prices plus worries\about the economy and the outlook for earnings are expected to\hang over the stock market this week during the depth of the\summer doldrums."
"3","Strategies for a Sideways Market"," WASHINGTON (Reuters) - The bulls and the bears are in this  together, scratching their heads and wondering what's going to  happen next."
"3","Art Looks Like Fine Investment for Funds"," NEW YORK (Reuters) - Some mutual funds invest in stocks;  others invest in bonds. Now a new breed of funds is offering  the chance to own fine art."
"3","Oil and Economy Cloud Stocks' Outlook"," NEW YORK (Reuters) - Soaring crude prices plus worries  about the economy and the outlook for earnings are expected to  hang over the stock market this week during the depth of the  summer doldrums."
"4","A Digital Doctor Treats Computer Contamination (washingtonpost.com)","washingtonpost.com - Before me lies the patient, a Gateway computer running Windows 98. It is suffering from extremely clogged Internet arteries, unable to reach the Web. As one of The Washington Post's digital doctors, my task is to nurse the machine back to health so my colleague Kathleen Day can access her e-mail and file stories from home."
"4","Microsoft Lists Apps Affected by XP SP2 (Ziff Davis)","Ziff Davis - Microsoft has published a list of nearly 50 software programs that require tweaking in order to work with its most recent Windows update."
"4","Europe's Eel Population Collapsing (AP)","AP - When a poacher with a baseball bat mugged Willem Dekker for his baby eels, it was further confirmation for the Dutch biologist that the species is in trouble."
"4","Genetic Material May Help Make Nano-Devices: Study (Reuters)","Reuters - The genetic building blocks that\form the basis for life may also be used to build the tiny\machines of nanotechnology, U.S. researchers said on Thursday."
"4","Progress Cargo Ship Launched From Russia (AP)","AP - A Russian cargo ship loaded with supplies and equipment blasted off from the Baikonour cosmodrome in Kazakhstan on Wednesday headed for the international space station, a Russian space official said."
"4","Computer Naivete Costs A Bundle","The meltdown of my home computer was my fault, the result of having switched to a high-speed Internet connection without installing a firewall or heeding those pesky warnings to download critical updates for Windows and anti-virus software. &lt;FONT face=""verdana,MS Sans Serif,arial,helvetica"" size=""-2""\ color=""#666666""&gt;&lt;B&gt;-The Washington Post&lt;/b&gt;&lt;/font&gt;"
"4","NASA Develops Robust Artificial Intelligence for Planetary Rovers","NASA is planning to add a strong dose of artificial intelligence (AI) to planetary rovers to make them much more self-reliant, capable of making basic decisions during a mission. Scientists are developing very complex AI software that enables a higher level of robotic intelligence."
"4","Science and President Bush Collide in Election Year","With more than 4,000 scientists, including 48 Nobel Prize winners, having signed a statement opposing the Bush administration's use of scientific advice, this election year is seeing a new development in the uneasy relationship between science and politics."
"4","Hurricane Charley's Force Took Experts by Surprise","By MARCIA DUNN     (AP) -- Hurricane Charley's 145-mph force took forecasters by surprise and showed just how shaky a science it still is to predict a storm's intensity - even with all the latest satellite and radar technology.    ""Most major hurricanes become major by going through a rapid intensification..."
"4","New Computer Games Teach Nutrition to Needy","In an effort to educate the nation's neediest children on nutrition, a new project uses the familiar medium of video games to broadcast its message. The Fantastic Food Challenge, a package of four computer games, is designed to teach people who get nutrition aid such as federal food stamps how to make better use of their food."
"4","Sprint Set to Debut Video-Streaming Cell Phone","OVERLAND PARK, Kan. (AP) -- Channel surfing is moving off the couch as Sprint Corp..."
"2","Kobe Bryant Due Back in Court Monday (AP)","AP - With Kobe Bryant's sexual assault trial scheduled to begin in less than two weeks, speculation is mounting that prosecutors are looking for a way to dismiss the charge after a series of setbacks."
"2","Rangers Designate Bacsik for Assignment (AP)","AP - Pitcher Mike Bacsik was designated for assignment by the Texas Rangers on Sunday after going 1-1 with a 4.60 ERA in three starts."
"2","Arsenal Beats Everton to Extend Streak (AP)","AP - Arsenal opened its defense of its English title with a 4-1 win at Everton on Sunday, making it 41 straight games without a loss in the Premier League."
"2","Nadal Wins in Poland for First ATP Title (AP)","AP - Spain's Rafael Nadal won his first ATP singles title Sunday, beating Argentina's Jose Acasuso 6-3, 6-4 in the final at the Idea Prokom Open."
"2","Zahringer Leads Field at U.S. Amateur (AP)","AP - George Zahringer III is back for another shot at the U.S. Amateur. The New Yorker is one of three returning quarterfinalists for the tournament, which begins Monday at the Winged Foot Golf Club. Lee Williams of Alexander City, Ala., and Patrick Carter of Lesage, W.Va., complete the trio from last year's championship that was won by Nick Flanagan of Australia."
"2","Pau Edges Yao in Clash of the Giants"," ATHENS (Reuters) - Spain's Pau Gasol got the better of  China's Yao Ming in Olympic basketball's own clash of the  giants Sunday."
"2","Hamilton Sets Early Pace as Woods Struggles"," KOHLER, Wis. (Reuters) - British Open champion Todd  Hamilton made the first significant move in the U.S. PGA  Championship final round Sunday as overnight pacesetter Vijay  Singh prepared for an afternoon tee-off."
"2","Iran Defies Olympic Spirit by Shunning Israel"," ATHENS (Reuters) - Iran's world judo champion Arash  Miresmaeili refused to compete against an Israeli Sunday,  triggering a fresh crisis at the Olympic Games where race,  creed or color are barred from interfering in sport."
"2","U.S. Softball Team Puts Australia in Its Place"," ATHENS (Reuters) - The United States kept itself firmly on  course for a third straight Olympic softball gold medal when it  thrashed Australia 10-0 Sunday."
"2","Schumacher Triumphs as Ferrari Clinches Title"," BUDAPEST (Reuters) - Michael Schumacher cruised to a record  12th win of the season in the Hungarian Grand Prix on Sunday to  hand his Ferrari team a sixth successive constructors' title."
"1","Nearly 10 Million Afghans to Embrace Democracy (Reuters)","Reuters - Thousands of U.S. troops in Afghanistan\may have failed to catch Osama bin Laden but they are credited\with encouraging millions of Afghans to register for the\country's historic election in October."
"1","Mortars Mark Opening of Iraqi Political Conference (Reuters)","Reuters - Insurgents fired mortars at a meeting\where Iraqi leaders met to pick an interim national assembly\Sunday, killing at least two people in a grim reminder of the\country's tortuous path toward democracy."
"1","Conference Gives Iraq Democracy First Test (AP)","AP - Despite the steady clang of mortar shells outside and persistent violence in the country, many delegates at the opening on Sunday of Iraq's National Conference held out hope that this first fragile taste of democracy would succeed."
"1","Countries Run Drills for Panana Attack (AP)","AP - The U.S. Coast Guard boarded the ship in the choppy Caribbean waters and began counting crew members, but the numbers did not match those given earlier."
"1","Police push for surveillance fee on customers' phone, Internet bills (Canadian Press)","Canadian Press - OTTAWA (CP) - Canada's police chiefs propose a surcharge of about 25 cents on monthly telephone and Internet bills to cover the cost of tapping into the communications of terrorists and other criminals."
"1","Bush should have tackled reform before naming CIA boss: lawmaker (AFP)","AFP - The top Democrat on the House intelligence committee urged fellow lawmakers not to allow confirmation hearings on a new CIA director to derail efforts to overhaul US spy agencies."
"1","Venezuelans Rush to Vote in Referendum on Chavez"," CARACAS, Venezuela (Reuters) - Venezuelans crowded polling  stations on Sunday to vote on whether to recall left-wing  President Hugo Chavez or back his mandate to govern the world's  No. 5 oil exporter for the next two years."
"1","TV: Iraqi Kidnappers of Iran Envoy Want POWs Freed"," TEHRAN (Reuters) - Kidnappers holding an Iranian diplomat  in Iraq will ""punish"" him within 48 hours if Iran does not  release 500 prisoners captured in its 1980-1988 war with Iraq,  Iranian state television said Sunday."
"1","Nearly 10 Million Afghans to Embrace Democracy"," KABUL (Reuters) - Thousands of U.S. troops in Afghanistan  may have failed to catch Osama bin Laden but they are credited  with encouraging millions of Afghans to register for the  country's historic election in October."
"1","Rebranded Liechtenstein Welcomes Fresh Prince"," VADUZ, Liechtenstein (Reuters) - The people of  Liechtenstein ushered in a new era Sunday as the tiny Alpine  principality welcomed a new ruler and sought to shed its image  as a haven for money launderers."
"1","France marks the 'other D-Day'","Two days of celebrations to honour the Allied veterans who liberated southern France near a climax."
"1","Phish farewell attracts thousands","""Jam band"" Phish play their last gigs together at a special festival in the US which has attracted thousands of fans."
"1","Iraq troops move angers S Koreans","Clashes with riot police erupt as thousands protest in Seoul against plans to send troops to help US-led forces in Iraq."
"1","Bush Surveys Damage in Florida as Toll Is Expected to Mount","Hurricane Charley - one of the most powerful storms in the nation's history - caused at least \$20 billion in damage in Florida alone."
"1","Phelps, Rival Thorpe in 200M-Free Semis","ATHENS, Greece - Michael Phelps took care of qualifying for the Olympic 200-meter freestyle semifinals Sunday, and then found out he had been added to the American team for the evening's 400 freestyle relay final.    Phelps' rivals Ian Thorpe and Pieter van den Hoogenband and teammate Klete Keller were faster than the teenager in the 200 free preliminaries..."
"1","Pope Struggles Through Mass at Lourdes","LOURDES, France - A sick man among the sick, Pope John Paul II struggled through Sunday Mass at a French shrine that draws desperate people seeking miracle cures. The 84-year-old pontiff gasped, trembled and asked aides for help during the 2 1/2 hour service in sizzling heat..."
"1","Singh, Leonard in Final Pairing at PGA","HAVEN, Wis. - Whistling Straits is suddenly the least of anyone's worries..."
"1","Venezuela Voters Turn Out in Huge Numbers","CARACAS, Venezuela - Voters turned out in huge numbers Sunday to decide whether to keep populist President Hugo Chavez in power or oust him and his social revolution that critics say has sidelined the middle class and fueled tensions between rich and poor.    Activists on both sides set off huge firecrackers and played recorded bugle songs to wake voters hours before dawn..."
"1","Reservists Say War Makes Them Lose Jobs","WASHINGTON - Increasing numbers of National Guard and Reserve troops who have returned from war in Iraq and Afghanistan are encountering new battles with their civilian employers at home. Jobs were eliminated, benefits reduced and promotions forgotten..."
"1","Wildfire Sweeps by Old Calif. Mining Town","REDDING, Calif. - A wind-fueled wildfire roared through an old mining town near Redding on Sunday, destroying 20 homes and forcing nearly 125 residents to flee, officials said..."
"1","Charley Damage Estimated at \$11 Billion","PUNTA GORDA, Fla. - As Florida residents began sweeping up the wreckage left behind by Hurricane Charley, officials on Sunday estimated damages as high as \$11 billion for insured homes alone..."
"4","Entertainment World Wary of Microsoft (AP)","AP - CinemaNow Inc., the Internet-based movie service, is a rarity in Hollywood  #151; a company that eagerly embraces Microsoft Corp. technology and relies on it exclusively to transmit, protect and display the movies it rents to customers. Then again, Microsoft is a major investor in the company, which is also owned by independent studio Lions Gate."
