"2","   Т. В. Володина        КУЛЬТУРА РЕГИОНА:  ХУДОЖЕСТВЕННАЯ КУЛЬТУРА    ВЕЛИКОГО НОВГОРОДА      ИЗБРАННЫЕ СТРАНИЦЫ             Великий Новгород               2002   ББК 71.1 я73(Но)                                  Печатается по решению   В 68                                            РИС НовГУ                                     Рецензенты          доктор философских наук, профессор С. Н. Иконникова          доктор философских наук, профессор С. Т. Махлина     .    Володина Т. В. В 68      Культура региона: Художественная культура Великого Новго-      рода. Избранные страницы. Учебное пособие. Великий Новгород:      НовГУ имени Ярослава Мудрого. – 88 с.           ISBN 5-89896-193-3              Учебное пособие «Культура региона: Художественная культура Велико-      го Новгорода. Избранные страницы» рассчитано, прежде всего, на студентов      гуманитарных специальностей, в учебный план которых включена эта дисцип-      лина. Особенностью данного издания является включение в него значитель-      ных фрагментов из монографий ведущих специалистов в области новгород-      ской архитектуры, монументальной живописи, иконописи, книжной миниатюры      и декоративно-прикладного искусства эпохи средневековья.                                                                          ББК        Издание осуществлено при поддержке Института «Откры-     тое Общество» (Фонд Сороса). Россия.                                             © Новгородский государственный                                               университет, 2002    ISBN 5-89896-193-3                     © Т. В. Володина, составление, 2002                                                                      3                               ВВЕДЕНИЕ" 
"2","В. П. Большаков        К. Ф. Завершинский             Своеобразие  культуры Нового времени        в ее развитии от Ренессанса до наших дней                                                          2   ББК 71.0                                                                    Печатается по решению    Б 76                                                                           РИС НовГУ                                                    Рецензенты                          доктор философских наук, профессор Э. В. Соколов                          кандидат философских наук, доцент Н. Н. Суворов     Большаков В.П., Завершинский К.Ф.    Своеобразие культуры Нового времени в ее развитии от Ренессанса до наших дней: Учебное пособие / Под ред. В. П. Большакова. – Великий Новгород: НовГУ имени Ярослава Мудрого, 2001. – 144 с., ил.  ISBN 5-7553-0028-3  Учебное пособие представляет собой продолжение ранее изданного (Большаков В. П., Новицкая Л. Ф. Особенности культуры в ее историческом развитии (от зарождения до эпохи Возрождения). Главы и разделы новой книги написаны: В. П. Большаковым – Гл. I, IV и V; К. Ф. Завершинским – Гл. II, Разд. 1, 2, 3 III главы; совместно – Предисловие и разд. 4 III главы.       При рассмотрении особенностей культуры авторами последовательно применен один из вариантов аксиологического подхода к пониманию ее смысла.       Авторы сознательно ограничились в основном материалом так называемой Западной культуры, считая, что она (и западноевропейская по происхождению цивилизация) наиболее существенно повлияла на все другие культуры, испытав и их, порой очень сильное, воздействие.       Книга будет полезной студентам вузов при изучении базовых культурологических курсов, студентам и аспирантам культурологических и исторических специальностей и специализаций изучающим курсы истории мировой культуры, мировой художественной культуры, а также – для научной работы. Учебное пособие может помочь и преподавателям высших и средних учебных заведений. Написанная достаточно просто, книга вполне пригодна и для неспециалистов, интересующихся историко- культурной проблематикой.                                                                                                             ББК 71.0     Издание осуществлено в соответствии с проектом поддержки кафедр программы «Высшее образование» Мегапроекта «Развитие образования в России» Института Открытое Общество.                                                                                           © В. П. Большаков, 2001                                                                                        © К.Ф.Завершинский, 2001                                                                                   3                                                                   СОДЕРЖАНИЕ" 
"2","В. П. Большаков    КУЛЬТУРА   КАК ФОРМА  ЧЕЛОВЕЧНОСТИ     УЧЕБНОЕ ПОСОБИЕ        ВЕЛИКИЙ НОВГОРОД            2000                                                   2     ББК 71.0                                                    Печатается по решению   Б 76                                                      РИСа НовГУ                                             Рецензенты              доктор философских наук, профессор Г. П. Выжлецов            доктор философских наук, профессор С. Н. Иконникова            доктор исторических наук, профессор П. А. Подболотов          Большаков В. П.     Культура как форма человечности. Учебное пособие. – Великий   Новгород: НовГУ имени Ярослава Мудрого, 2000. – 92 с.              В книге рассматривается смысл культуры и особенности ее проявлений. Автор последовательно      развивает и конкретизирует современные аксиологические представления о культуре и ее ценностях.          Для специалистов в областях философии и культурологии, аспирантов и студентов вузов, и для      всех, интересующихся проблемами культуры.        Издание осуществлено в соответствии с проектом поддержки      кафедр программы «Высшее образование» Мегапроекта «Развитие      образования в России» Института Открытое Общество                                                         ББК 71.0                                                                       © В.П.Большаков, 2000                                                                   3                                                     СОДЕРЖАНИЕ   ПРЕДИСЛОВИЕ " 
"2","   63.3 (гр)                                    №3497  И-907                                            МИНИСТЕРСТВО ОБРАЗОВАНИЯ                                             РОССИЙСКОЙ ФЕДЕРАЦИИ                                  ГОСУДАРСТВЕННОЕ ОБРАЗОВАТЕЛЬНОЕ УЧРЕЖДЕНИЕ                                  ВЫСШЕГО ПРОФЕССИОНАЛЬНОГО ОБРАЗОВАНИЯ                                       ТАГАНРОГСКИЙ ГОСУДАРСТВЕННЫЙ                                      РАДИОТЕХНИЧЕСКИЙ УНИВЕРСИТЕТ       КАФЕДРА ИСТОРИИ И ФИЛОСОФИИ                                  История культуры России                                 в хронологических таблицах                                 Для студентов всех специальностей     ЕГФ                                        Таганрог 2004   ББК 63.3 (гр)            Папченко Е.В.     История    культуры    России     в хронологических таблицах. Для студентов всех специальностей. Таганрог: Изд-во ТРТУ, 2004. с.          В данном пособии показана история возникновения и развития отечественной культуры, ее самобытность, открытость другим народам. Пособие предназначено для студентов всех специальностей.                           Рецензент        Бурьков В.В., кандидат исторических наук, доцент кафедры истории и философии Таганрогского государственного радиотехнического университета.                                  2          КУЛЬТУРА ДРЕВНЕЙ И СРЕДНЕВЕКОВОЙ РУСИ " 
"2","  Ю.А. ТОЛМАЧЕВ     НАРОДНОЕ МУЗЫКАЛЬНОЕ  ТВОРЧЕСТВО                                         ♦ ИЗДАТЕЛЬСТВО ТГТУ ♦ УДК 78+398(075) ББК Щ31я73     Т524                                                   Р е ц е н з е н т ы:                                   Заслуженный деятель искусств РФ, профессор,                             ректор Воронежской государственной академии искусств                                                 В.Н. Семенов                          Кандидат педагогических наук, доцент, проректор по научной и                                методической работе Тамбовского государственного                           музыкально-педагогического института им. С.В. Рахманинова                                                И.Н. Вановская                                         Кандидат педагогических наук,                            старший преподаватель кафедры музыкального образования                         Тамбовского государственного университета им. Г.Р. Державина.                                               А.Ю. Любомудрова               Толмачев, Ю.А. Т524       Народное музыкальное творчество : учебное пособие / Ю.А.        Толмачев. – Тамбов : Изд-во Тамб. гос. техн. ун-та, 2006. – 120 с.        – 5 экз.           Рассматриваются сущность и специфика народного музыкального        творчества, феномен музыкального фольклора исследуется в целостном        контексте художественной культуры общества как ее особый пласт, в        центре внимания оказываются фольклор как феномен художественной        культуры, его синкретичная природа, устная форма бытования, истори-        ческая периодизация и жанровая система, изучаются также методологи-        ческие и методические особенности исследования художественных        образцов и практических навыков исполнения народных песен.           Предназначено для студентов высших учебных заведений и учреж-        дений среднего профессионального образования.                                                         УДК 78+398(075)                                                         ББК Щ31я73                                   © Толмачев Ю.А., 2006                                 © ГОУ ВПО "Тамбовский государственный                                    технический университет" (ТГТУ), 2006                             Ю.А. Толмачев   НАРОДНОЕ МУЗЫКАЛЬНОЕ ТВОРЧЕСТВО           Допущено Министерством образования Российской Федерации в качестве учеб-      ного пособия для студентов высших учебных заведений, обучающихся по специально-      сти 053000 "Народное художественное творчество"                                     Тамбов                           Издательство ТГТУ                                  2006                                 Учебное издание                    ТОЛМАЧЕВ Юрий Александрович      НАРОДНОЕ МУЗЫКАЛЬНОЕ ТВОРЧЕСТВО                              Учебное пособие                         Редактор О.М. Я р ц е в а      Инженер по компьютерному макетированию М.Н. Р ы ж к о в а                          Подписано в печать 23.11.2006.       Формат 60 × 84/16. Бумага офсетная. Гарнитура Тimes New Roman.                    7,2 уч.-изд. л. Тираж 5 экз. Заказ № 693                    Издательско-полиграфический центр        Тамбовского государственного технического университета               392000, Тамбов, Советская, 106, к. 14                     Ю.А. ТОЛМАЧЕВ         НАРОДНОЕ МУЗЫКАЛЬНОЕ ТВОРЧЕСТВО" 
"2","Министерство транспорта России  Дальневосточная государственная морская академия         имени адмирала Г.И. Невельского                      Е.Э. Дробышева   ИСТОРИЯ РАЗВИТИЯ МИРОВОЙ КУЛЬТУРЫ       Краткий конспект в таблицах        Часть I. Европейская культура                   Учебное пособие          Рекомендовано методическим советом Дальневосточной государственной морской академии в качестве учебного пособия для всех специальностей                        Владивосток                       2001   УДК 519.6 (075.8)        Дробышева Е.Э. История развития мировой культуры. Краткий конспект в таблицах: Учеб. пособие. – Владивосток: ДВГМА, 2000. – 45 с.       Конспективно излагаются сведения по разделу «Типология культуры» курса культурологии. Изложенный материал скомпонован в таблицы.       Предназначено для всех специальностей.       Табл. 38, библиогр. 6 назв.                                         Рецензенты:                                     Ячин С. Е., докт. филос. наук, проф.,                                     зав. кафедры философии ДВГТУ.                                     Сакутин В.А., канд. филос. наук, проф.,                                     доцент кафедры ПИПКРО                                         ©Дробышева Е.Э.                                     ©Дальневосточная государственная                                      морская академия                                      им. адм. Г. И.Невельского, 2001     2" 
"2"," МИНИСТЕРСТВО ОБРАЗОВАНИЯ РОССИЙСКОЙ ФЕДЕРАЦИИ      Кемеровский государственный университет         Кафедра истории и теории культуры                      А. В. Горбатов                  Ю. И. Михайлов             ОСНОВНЫЕ ШКОЛЫ                         И  КОНЦЕПЦИИ КУЛЬТУРОЛОГИИ              Учебное пособие                      Кемерово 2000        Рецензенты: доктор философ. наук, профессор Г.С. Баранов                   канд. психол. наук, доцент М.С. Яницкий        Горбатов А.В., Михайлов Ю.И.      Основные школы и концепции культурологии. // Учебное пособие.- Кемерово: Кемеровский государственный университет, 2000.- 83 с.          Специфика настоящего пособия состоит в систематичном изложении общепризнанных типов теорий культуры и культурологических проблем. К последним относится анализ соотношения культуры и мышления, культуры и цивилизации, культуры и личности, личности и природы, а также различных аспектов типологии культуры.      Учебное пособие написано в соответствии с установленным требовани- ем государственного образовательного стандарта и предназначено студентам вузов и учащимся, изучающих курс "Культурология".                                       © Горбатов А.В., Михайлов Ю.И., 2000                                   © Кемеровский госуниверситет, 2000                                         2   Введение " 
"2","МИНИСТЕРСТВО ОБРАЗОВАНИЯ И           НАУКИ РОССИЙСКОЙ ФЕДЕРАЦИИ      ФЕДЕРАЛЬНОЕ АГЕНТСТВО ПО ОБРАЗОВАНИЮ             Технологический институт          Федерального государственного           образовательного учреждения       высшего профессионального образования         «Южный федеральный университет»      М.А. Дедюлина, Е.В. Папченко  Основы культурологических знаний           Учебное пособие                 Таганрог 2008       ББК 63.3 (2Р) я73                             Рецензенты:      А.М. Майданский, доктор философских наук, профессор кафедры философии и социологии Таганрогского института управления и экономики;      Н.А. Ороев, кандидат философских наук, доцент кафедры истории и философии Технологического института Южного федерального университета.      Дедюлина М.А., Папченко Е.В.      Основы культурологических знаний: Учебное пособие. – Таганрог: Изд-во ТТИ ЮФУ, 2008. – 184 с.       Данное пособие составлено в соответствии с требованиями Госстандарта для вузов, учебной программы и включает материалы по    культурологии.    Предназначено   для    студентов   всех специальностей.                                 © Таганрогский      технологический                             институт ЮФУ, 2008                             © Дедюлина М.А., 2008                             © Папченко Е.В., 2008                                    2                          О, сколько нам открытий чудных                        Готовят просвещенья дух                        И опыт, сын ошибок трудных,                        И гений, парадоксов друг,                        И случай, бог изобретатель.                                     А.С. Пушкин  Где есть поветрие на чтенье, В чести там грамота, перо, Где грамота, там просвещенье, Где просвкещенье – там добро.               П.А. Вяземский  Человек без знаний, что цветы без запаха.                        Казахская пословица  Человек без знаний, что бревно или камень.                        Японская пословица  Если путь твой к познанию мира ведет, - Как бы ни был он долог – вперед!                   А. Фирдоуси  Разум есть – ты человек, Нет – ты тварь иная. Так точи его как меч, Устали не зная. Есть один творец всех благ – Золотые руки. Будешь мудростью богат – Изучай науки.               В.А. Ивлиев                              3                                                  Введение" 
