"1","Bush Vows Rapid Aid to Hurricane Victims","PUNTA GORDA, Fla. - Residents left homeless by Hurricane Charley's 145 mph winds dug through their ravaged homes on Sunday, sweeping up shattered glass and rescuing what they could as President Bush promised rapid delivery of disaster aid..."
"3","Nikkei Down at Midday on Oil Worries"," TOKYO (Reuters) - Tokyo's Nikkei fell 1.66 percent by  midday on Monday, extending losses into a third day as growing  fears about the impact of surging oil prices on the global  economy hit exporters such as Toyota Motor Corp."
"4","Dell Exits Low-End China Consumer PC Market (Reuters)","Reuters - Dell Inc. (DELL.O), the world's\largest PC maker, said on Monday it has left the low-end\consumer PC market in China and cut its overall growth target\for the country this year due to stiff competition in the\segment."
"2","Singh Wins Playoff and P.G.A. Title","Several players outplayed Vijay Singh on Sunday, but nobody outlasted him at the 86th P.G.A. Championship."
"3","Caterpillar Union Rejects Contract Offer"," CHICAGO (Reuters) - United Auto Workers (UAW) said its  members at Caterpillar Inc on Sunday voted to reject the  construction equipment maker's contract proposal, the second  time this year workers have voted against a Caterpillar  contract offer."
"3","NYMEX Crude Hits Record \$46.76"," SINGAPORE (Reuters) - NYMEX crude oil futures &lt;CLc1&gt; hit a  new record of \$46.76 on Monday on worries about possible unrest  and disruption to oil supply as Venezuelans voted in a  referendum on whether to recall President Hugo Chavez."
"2","Singh Wins Playoff to Seize Third Major Title"," KOHLER, Wisconsin (Reuters) - Fiji's Vijay Singh held his  composure to win the 86th U.S. PGA Championship in a three-way  playoff on Sunday, clinching the third major title of his  career."
"1","South Korea Warns of Possible North Terrorism (Reuters)","Reuters - North Korea is threatening to use\terrorism against the South, Seoul's intelligence agency said\in a rare public advisory on Monday, and warned South Korean\citizens in China and Southeast Asia to be on their guard."
"1","Afghans Hail Chance for a Choice","BAZARAK, Afghanistan&lt;br&gt;Like virtually every adult in this Panjshir Valley village, Rahmal Beg registered to vote weeks ago. Indeed, popular enthusiasm is so high for the Oct. 9 presidential election -- the first in Afghan history -- that thousands of people in the valley have reportedly..."
"3","Caterpillar Union Rejects Contract Offer"," CHICAGO (Reuters) - The main union at Caterpillar Inc. said  its members voted on Sunday to reject the construction  equipment maker's contract proposal, the second time this year  the workers have voted against an offer."
"3","GM's Made-In-China Cadillacs in Early '05"," SHANGHAI (Reuters) - General Motors, the world's largest  automaker, will start selling its first made-in-China Cadillacs  in early 2005 in a market it expects eventually to account for  a fifth of global sales of the luxury brand."
"1","Gas Prices Drop, but Increase Expected","CAMARILLO, Calif. - Gas prices have dropped nearly 5 cents in the past three weeks with an increase in supply, but soaring crude oil prices could cause rates to rise again soon, an industry analyst said Sunday..."
"2","Funk Still Gets Cup Spot","Though Fred Funk had been rather morose after missing the cut by a stroke in the 86th PGA Championship on Friday, there was great joy on Sunday."
"1","Report: U.S. to Approve Sale of Aegis Ships to Taiwan (Reuters)","Reuters - The United States will announce the sale\of four Aegis missile-defense warships to Taiwan next year with\delivery likely to begin in 2011, a newspaper said on Monday."
"1","Nikkei Down, Oil Worries Hit Exporters (Reuters)","Reuters - Tokyo's Nikkei fell 1.66 percent by\midday on Monday, extending losses into a third day as another\surge in oil prices deepened worries about the global economic\impact and knocked down exporters such as Toyota Motor Corp."
"1","Report: U.S. to Approve Sale of Aegis Ships to Taiwan"," TAIPEI (Reuters) - The United States will announce the sale  of four Aegis missile-defense warships to Taiwan next year with  delivery likely to begin in 2011, a newspaper said on Monday."
"3","Wal-Mart Tries to Shine Its Image by Supporting Public Broadcasting","Wal-Mart, stung by criticism of its business tactics, is working to improve its image by supporting public broadcasting."
"3","Muddling Through (or Not): Mid-2004 Update on the Philippines","Looks like the Philippines, despite itself, has survived the election without excessive violence, major civil unrest, or untoward People Power eruptions. GMA finally has that elusive electoral mandate, and the air of uncertainty that pervaded Manila in the weeks leading up to the election has given way to (for some) an air of cautious optimism or (for others) resignation that nothing ever changes much in the Philippines and that the strong leadership and fundamental changes needed to save the country are long shots."
"2","Unseeded Vaidisova Wins Vancouver Open (AP)","AP - Unseeded teenager Nicole Vaidisova defeated American Laura Granville 2-6, 6-4, 6-2 in the final of the Vancouver Open on Sunday."
"1","F.B.I. Goes Knocking for Political Troublemakers","The F.B.I. has been questioning demonstrators in an effort to forestall violent protests at the Republican convention."
"4","Sybase looks ahead to RFID","The database and mobile software company is set to reveal details on updates to its flagship products and outline RFID plans."
"4","Nanotech funding to grow to \$8.6 billion","Spending on research will more than double this year, with a growing amount coming from the private sector."
"4","Gateway lands on another retailer's shelves","Company is set to sell desktops on CompUSA's shelves, providing more competition for HP."
"2","Cardinals Ride Rolen","Scott Rolen homered twice to become the first NL player to reach 100 RBIs this season as the St. Louis Cardinals downed the Atlanta Braves, 10-4, on Sunday night."
"2","Braves Hum Along","Braves General Manager John Schuerholz shuffled his deck more than usual this past offseason so doubts were high. Such a challenge makes this season all the sweeter."
"1","Tibet's Second-Holiest Monk Makes Rare Lhasa Visit (Reuters)","Reuters - Tibet's second-holiest monk, the Panchen\Lama, has visited Lhasa on a rare trip to the Himalayan region\by the living Buddha, whose selection in 1995 was marred by\controversy after the exiled Dalai Lama chose another boy."
"1","Greek duo could miss drugs hearing","Kostas Kenteris and Katerina Thanou may not be fit enough to attend the hearing into their missed drugs test."
"1","Package prompts US embassy alert","An unidentified substance  sent to the US embassy in the Malaysian capital Kuala Lumpur leads to a security scare. "
"4","Don't Fear Internet Anonymity Tools (Ziff Davis)","Ziff Davis - There are lots of good reasons for 'net anonymity."
"4","Time Is Now for Linux Vendors to Protect Users (Ziff Davis)","Ziff Davis - Opinion: It's time for other Linux vendors to follow Red Hat's lead and offer patent infringement protection to their customers."
"4","Self-Healing Tech Could Boost IBM's Yield (Ziff Davis)","Ziff Davis - Designed to let processors adjust themselves dynamically in response to problems or systems demands without human intervention, the chip-morphing technology could help IBM  keep up with demand for good chips."
"1","Emergency defers Maldives debate","A parliamentary session due to have begun on Monday in the Maldives has been postponed indefinitely."
"1","Tigers reject Sri Lanka counter proposal to revive talks (AFP)","AFP - Sri Lanka's Tamil Tiger rebels said they will spurn any new government proposals to revive peace talks not giving them self-rule as peacebroker Norway was set to try to jumpstart the negotiations."
"3","In Google's Auction, It's Not Easy to Tell a Bid From a Bet","In a competition combining suspense and strategy, countless brave souls are hoping to buy a small piece of Google in an auction this week."
"1","Suspicious Powder Found at U.S. Embassy in Malaysia"," KUALA LUMPUR (Reuters) - Suspicious white powder has been  found in an envelope that arrived at the U.S. embassy in  Malaysia and three staff members quarantined, an embassy  official and police said on Monday.  ""A letter was delivered that had a suspicious powder in it,""  said an embassy spokesman in Kuala Lumpur. ""The powder is being  sent for testing."""
"3","Nikkei Hits 3-Mth Closing Low"," TOKYO (Reuters) - Tokyo's Nikkei average fell 0.65 percent  to a fresh three-month closing low on Monday as crude oil  prices again hit record highs in Asian trading hours, clouding  the outlook for the global economy."
"2","DiMarco, Riley Get on Ryder Cup Team (AP)","AP - Hal Sutton had a good idea what kind of U.S. team he would take to the Ryder Cup. All that changed in the final round of the PGA Championship."
"1","Chinese dig for villagers buried under landslides after deadly typhoon (Canadian Press)","Canadian Press - SHANGHAI, China (AP) - Villagers in an eastern province dug with farm tools Monday to search for 24 people missing in massive landslides unleashed by Typhoon Rananim, which has already been blamed for 115 deaths and is the worst such storm to hit China in seven years."
"1","Americans appear in Kabul trial","The second hearing in the trial of three Americans accused of torture and running a jail begins in Kabul."
"3","Stocks Fall as Oil Hits High"," SINGAPORE (Reuters) - Exporters led a fall in Asian shares  on Monday as oil prices set new highs near \$47 and data showing  the U.S. trade deficit widened to a record raised fresh concern  about the health of the world's largest economy."
"3","Stocks Fall as Oil Hits High (Reuters)","Reuters - Exporters led a fall in Asian shares\on Monday as oil prices set new highs near  #36;47 and data showing\the U.S. trade deficit widened to a record raised fresh concern\about the health of the world's largest economy."
"1","Israel Turns Up Heat on Palestinian Hunger Strike (Reuters)","Reuters - Israel declared psychological war on\hunger-striking Palestinian prisoners on Monday, saying it\would barbecue meat outside their cells to try to break their\will."
"1","Two Chinese salesman gunned down in Thailand's restive south (AFP)","AFP - Two Chinese travelling salesmen have been gunned down in southern Thailand as part of separatist violence which has claimed more than 275 lives since the start of the year, officials said."
"1","Israel Turns Up Heat on Palestinian Hunger Strike"," JERUSALEM (Reuters) - Israel declared psychological war on  hunger-striking Palestinian prisoners on Monday, saying it  would barbecue meat outside their cells to try to break their  will."
"3","Iranian economic reform falters","The Iranian parliament votes against key parts of a reform plan aimed at opening the economy to foreign investment."
"3","Space-age sport ","GPS is invading recreational sports. Under clear skies, those signals beaming to earth from satellites can find you on a hilly running trail, in a kayak on the ocean, or on a green fairway where you're trying to fade a 230-yard drive into the wind."
"3","Eyes tired? Musical alerts ease computer user #146;s day","What was the last sound your computer made? It may have emitted a chime when e-mail arrived, or a heraldic swish when you started up Windows."
"3","As money-raisers, 2004 #146;s initial offerings fall short","When Inhibitex Inc. set the terms of its initial public offering in March, it thought it was being conservative, expecting shares to sell for \$10 to \$12 apiece."
"3","Internet publishing attracting academics","BALTIMORE -- Manuel Llinas knew his career was at stake. The young scientist had just finished work on an eye-catching paper on the genome of a parasite that causes malaria. Now he and his lab director faced a critical decision: where to submit the article for publication."
"3","Computers with multiple personalities","The jury's still out on whether a computer can ever truly be intelligent, but there's no question that it can have multiple personalities. It's just a matter of software."
"2","Paint it bleak","If the Rolling Stones were hired to write the theme song for this year's Red Sox, the group might overhaul one of their classics. Instead of  quot;Satisfaction, quot; they could go with  quot;Separation. quot; That's because no matter how hard they try, the Sox can't get no separation in their quest for the top spot in the wild-card race."
"2","He #146;s not short on confidence","It's a case he could have made more convincingly with something other than a half-swing tapper to the pitcher for the final out of yet another in a seemingly endless series of one-run losses for the Red Sox. But Orlando Cabrera wants fans to believe this: For all the futile swings he has made in his two-week incarnation as a ..."
"2","Pronger opts out of World Cup","Names Chris Pronger of the St. Louis Blues pulled out of the World Cup of Hockey yesterday with an undisclosed injury, and was replaced on the Canadian team by Jay Bouwmeester of the Florida Panthers. Pronger's decision comes less than a week before the Canadian team opens training camp. The team will practice for the first time Friday in Ottawa. ..."
"2","Giants finish off Phillies","Brett Tomko allowed one run in six innings for his first win in nearly a month, and the San Francisco Giants closed in on the wild-card lead with a 3-1 victory over the Phillies yesterday in Philadelphia, completing a three-game sweep."
"2","Texas goes wild","The Red Sox have company atop the wild-card standings. In Arlington, Texas, Laynce Nix homered and drove in three runs, including a tiebreaking sacrifice fly, and the Rangers beat the Tampa Bay Devil Rays, 6-2, yesterday to sweep the three-game series."
"2","49ers #146; Beasley out till opener","The cheers went up the instant Willis McGahee took the field. How's that for pressure?"
"2","At least Light #146;s sense of humor still intact","FOXBOROUGH -- Matt Light lost his appendix this summer and, as a result, quite a few pounds, but he didn't lose one ounce of his wit."
"2","Dorman #146;s been dandy of late","Revolution coach Steve Nicol is not taking credit for the emergence of Andy Dorman. But Nicol's tactical moves helped place Dorman in a position to score his first two goals as a professional, in the final seconds of a 3-0 win at Dallas Wednesday and on his first touch of Saturday night's game at D.C. United for the Revolution's second ..."
"1","Sudan refugees report new attacks","More Sudanese refugees flee across the border into Chad following reports of renewed violence in the Darfur region."
"1","Bomb at parade in India leaves 16 dead, 40 hurt","NEW DELHI -- A powerful bomb killed at least 16 people, many of them schoolchildren, and wounded about 40 others as they assembled for an Independence Day parade yesterday in the northeastern state of Assam, authorities said."
"1","Israeli speaks out on McGreevey","JERUSALEM -- The Israeli man at the center of the resignation of New Jersey's governor, James E. McGreevey, over a gay affair said in an interview published yesterday that he is straight and had no idea at first that his boss is homosexual."
"1","France remembers WWII Riviera mission","ABOARD THE CHARLES DE GAULLE -- France yesterday honored soldiers, including tens of thousands of Africans, who staged an assault on the French Riviera 60 years ago to break the Nazi grip -- one of the least-remembered military operations of World War II."
"1","Pope struggles at shrine Mass","LOURDES, France -- A sick man among the sick, Pope John Paul II struggled yesterday through Sunday Mass at a French shrine that draws desperate people seeking miracle cures. The 84-year-old pontiff gasped, trembled, and asked aides for help during the 2-hour service in the sizzling heat."
"1","Uncertainty as Venezuela Awaits Referendum Result"," CARACAS, Venezuela (Reuters) - Three Venezuelan government  ministers said on Monday President Hugo Chavez had easily  survived a referendum on whether to recall him but their  comments conflicted with heavy opposition hints they had won."
"4","Watchdog attacks ID card scheme","Proposals for identity cards and a population register are opposed by Britain's information watchdog."
"4","Ebookers sees 'encouraging' signs","Internet-based holiday company Ebookers says second-quarter loses have been cut compared with the same period a year ago."
"1","Chavez Wins Venezuela Referendum-Official Results (Reuters)","Reuters - Venezuelan President Hugo\Chavez has survived a referendum to recall him, according to\results released by electoral authorities on Monday with 94\percent of the vote counted."
"1","US embassy in Malaysia in 'anthrax scare' (AFP)","AFP - Malaysian emergency services rushed to the tightly-guarded US embassy in Kuala Lumpur after a powder which police said could be anthrax was found in a letter."
"4","UN creates game to tackle hunger","A forthcoming video game aims to educate children about the global fight against hunger."
"1","Chavez Wins Venezuela Referendum-Preliminary Result"," CARACAS, Venezuela (Reuters) - Venezuelan President Hugo  Chavez has survived a referendum to recall him, according to  preliminary results released by the country's top electoral  officer on Monday."
"3","Oil Prices Hit Record (Reuters)","Reuters - Oil prices jumped to a new record\high near  #36;47 on Monday with traders on tenterhooks for the\result of Venezuela's weekend referendum and Iraq's exports\again disrupted by a Shi'ite uprising in the south."
"2","They flocked from Games","ATHENS -- During yesterday's celebration of the assumption of the Virgin Mary, the Greek orthodox clergy had a stern reminder for the organizers of the Olympic Games: No matter what the advertisements and speeches say about Greece's modern, Western orientation, this country is still the domain of its decidedly traditional, ubiquitous state-sanctioned religion. Speaking over the Byzantine chants of a ..."
"2","Ginobili gives Argentina big lift at the buzzer","Manu Ginobili's off-balance shot left his hand just a split-second before the final buzzer, dropping through the basket to give Argentina an 83-82 victory over Serbia-Montenegro yesterday on the first day of Olympic men's basketball in Athens."
"2","Stewart spoils upset bid","Sports car ace Ron Fellows nearly pulled off what arguably would have been the biggest upset in NASCAR history, finishing second after starting last yesterday at Watkins Glen (N.Y.) International."
"2","US eights glide to finals in record times","The US men's and women's eights pulled off huge victories in yesterday's Olympic rowing heats, each setting world bests to advance directly to Sunday's finals."
"2","Phelps #146;s quest for 8 golds goes under","ATHENS -- The evening began on a down note for the US swimming team, and descended from there. First, world champion Jenny Thompson struggled home fifth in the 100-meter butterfly. Then world record-holder Brendan Hansen was caught by Japan's Kosuke Kitajima in the 100 breaststroke. Finally, the men's 4 x 100 freestyle relay finished third behind South Africa and the ..."
"2","Azevedo shot does trick","Tony Azevedo whizzed a last-second shot past Croatian goalkeeper Frano Vican to give the American water polo team a 7-6 victory in its tournament opener yesterday."
"2","US team kicks over this result","ATHENS -- Did Japan's Kosuke Kitajima break the rules when he beat world record-holder Brendan Hansen by 17-100ths of a second in yesterday's Olympic 100-meter breaststroke? Absolutely, insisted Hansen's US teammates, who claimed Kitajima routinely uses the illegal dolphin kick."
"2","Clout shown in rout","ATHENS -- When the Olympic softball schedule was released, Lisa Fernandez grabbed a marker and began counting down the days.  quot;This game is always on my calendar, quot; she said.  quot;I have a tremendous history with Australia. quot; And until yesterday, mostly a haunting one."
"2","Punching his way forward","ATHENS -- There's only room for one Cinderella in a boxing ring. That was the sad lesson Andre Berto learned last night as his long road to the Olympic Games came to an abrupt end at the Peristeri Boxing Hall in his first fight in the welterweight division. First fight, that is, unless you understand what it took for him ..."
"1","Fighting rages in South Ossetia","Heavy fighting erupts in Georgia's breakaway South Ossetia region, shattering a two-day ceasefire."
"4","Sprint Puts Streaming Media on Phones","PCS Vision Multimedia streams faster video plus audio channels to Samsung phone."
"2","Phelps, Thorpe Face Dutch Threat"," ATHENS (Reuters) - Michael Phelps, one gold won but one of  his eight title chances now lost, takes on Ian Thorpe and  Pieter van den Hoogenband in their long-awaited showdown in the  200 meters freestyle final on Monday."
"1","Liechtenstein royals swap power","Liechtenstein's Prince Hans-Adam hands over power to his son and invites the whole nation to a garden party."
"1","Venezuelan President Survives Recall Vote","CARACAS, Venezuela - President Hugo Chavez appeared to have survived a popular referendum to oust him, according to early results Monday, while Venezuela's opposition swiftly claimed fraud.    Backers of the leftist populist president set off fireworks and began celebrating in the streets of the capital in the pre-dawn darkness upon hearing the news from Francisco Carrasquero, president of the National Elections Council..."
"1","Rescue Teams Aid Hurricane Charley Victims","PUNTA GORDA, Fla. - Urban rescue teams, insurance adjusters and National Guard troops were scattered across Florida to help residents rally from the brunt of Hurricane Charley, the worst storm to hit the state in a dozen years..."
"1","Journalist, Translator Missing in Iraq (AP)","AP - A French-American journalist has disappeared along with his Iraqi translator in the southern Iraqi city of Nasiriyah, the provincial deputy governor said Monday."
"1","Prudential drops bid for S.Korean assest managing firm (AFP)","AFP - A consortium led by British insurer Prudential PLC has dropped its bid for a major South Korean state asset managing company."
"1","Bush Plans to Withdraw Troops From Abroad (AP)","AP - President Bush's plan to call tens of thousands of U.S. troops home from Europe and Asia could gain him election-year applause from military families, but won't ease the strain on soldiers still battling violent factions in Iraq and Afghanistan."
"1","Pair tell of 'Falconio' sighting","Two witnesses tell an Australian court they saw UK backpacker Peter Falconio more than a week after he disappeared."
"4","'Virtual' repairs for Cutty Sark","Digital models of an historic ship are created as part of its restoration to test if it will survive the process."
"1","Mass. Republicans Eye Kerry's Senate Seat (AP)","AP - Massachusetts Republicans, while supportive of President Bush's re-election, are mindful of the opportunity created should John Kerry beat him in November's election: the state's first Senate vacancy in two decades and a chance to break the Democratic monopoly on its 12-member delegation in Congress."
"3","Swatch tax complaint dismissed","US officials dismiss claims of tax evasion levelled at watchmaker Swatch by two former employees."
"3","Small firms struggle as oil soars","Small manufacturers in the UK are struggling in the face of soaring oil prices and higher interest rates, the CBI says."
"3","Microsoft takes down SP2 swappers","Microsoft is stopping people getting hold of a key security update via net-based file- sharing systems."
"4","Symantec Readies Patching Tool","ON IPatch monitors, ensures networked Windows systems are current in midsize businesss."
"1","Panchen Lama Visits Tibet Capital (AP)","AP - The boy chosen by the Chinese government as the reincarnation of the Panchen Lama was greeted warmly by dozens of monks when he visited Tibet's most sacred temple, state television reported, giving rare publicity to one of his appearances."
"4","BearingPoint Wins ID Project at TSA","BearingPoint Inc. of McLean won a \$12 million contract from the Transportation Security Administration to begin the third phase in the agency's program to create a standard identification card for U.S. transportation employees."
"4","Government Spending Up Sharply Locally","Federal procurement spending in the Washington area rose last year at its highest rate since the 1980s, according to a study to be released today, creating tens of thousands of jobs and increasing economic growth disproportionately in Northern Virginia."
"4","Expense Issue Draws Mixed Views From Companies","The debate over whether companies should  treat stock options as an expense draws mixed reactions from Washington area businesses, some of which have a lot to lose if the accounting rule changes."
"1","Palestinian Prisoners Launch Hunger Strike","JERUSALEM - More than a thousand Palestinian prisoners went on a hunger strike to press for better conditions, but Israel responded by tightening inmate restrictions, and a Cabinet minister said he wouldn't care if they starved to death.    About 1,600 prisoners struck on Sunday..."
"3","Europe and US in aircraft aid row","The European Commission and President George Bush are in a war of words over subsidies given to aircraft makers Airbus and Boeing."
"1","Ex-Chess Champion Fischer to Marry Japanese Woman"," TOKYO (Reuters) - In a bold gambit worthy of the chess  champion he once was, Bobby Fischer plans to wed a four-time  Japan great in the hope of avoiding deportation home to the  United States, where he is wanted for breaking sanctions."
